Enter password: ****
Welcome to the MySQL monitor.  Commands end with ; or \g.
Your MySQL connection id is 8
Server version: 8.0.42 MySQL Community Server - GPL

Copyright (c) 2000, 2025, Oracle and/or its affiliates.

Oracle is a registered trademark of Oracle Corporation and/or its
affiliates. Other names may be trademarks of their respective
owners.

Type 'help;' or '\h' for help. Type '\c' to clear the current input statement.

mysql> show databases;
+--------------------+
| Database           |
+--------------------+
| fbs                |
| firstbit_sql       |
| information_schema |
| july25             |
| mysql              |
| performance_schema |
| sakila             |
| sys                |
| world              |
+--------------------+
9 rows in set (0.01 sec)

mysql> use july25;
Database changed
mysql> show tables;
+------------------+
| Tables_in_july25 |
+------------------+
| branch           |
| dept             |
| emp              |
| room             |
| student          |
+------------------+
5 rows in set (0.01 sec)

mysql> desc emp;
+---------+-------------+------+-----+---------+----------------+
| Field   | Type        | Null | Key | Default | Extra          |
+---------+-------------+------+-----+---------+----------------+
| eid     | int         | NO   | PRI | NULL    | auto_increment |
| name    | varchar(20) | NO   |     | NULL    |                |
| salary  | int         | YES  |     | NULL    |                |
| mobno   | int         | YES  | UNI | NULL    |                |
| address | varchar(20) | YES  |     | Pune    |                |
| dno     | int         | YES  | MUL | NULL    |                |
| age     | int         | YES  |     | NULL    |                |
| gender  | varchar(1)  | YES  |     | NULL    |                |
| j_date  | date        | YES  |     | NULL    |                |
+---------+-------------+------+-----+---------+----------------+
9 rows in set (0.01 sec)

mysql> table emp;
+-----+--------+--------+-----------+----------+------+------+--------+------------+
| eid | name   | salary | mobno     | address  | dno  | age  | gender | j_date     |
+-----+--------+--------+-----------+----------+------+------+--------+------------+
| 101 | Deepak |  26000 | 985012468 | Parbhani |    1 |   23 | M      | 2023-02-23 |
| 102 | Sakshi |   NULL | 985012456 | Pune     | NULL | NULL | F      | NULL       |
+-----+--------+--------+-----------+----------+------+------+--------+------------+
2 rows in set (0.03 sec)

mysql> desc dept;
+----------+-------------+------+-----+---------+-------+
| Field    | Type        | Null | Key | Default | Extra |
+----------+-------------+------+-----+---------+-------+
| dno      | int         | NO   | PRI | NULL    |       |
| name     | varchar(20) | YES  |     | NULL    |       |
| location | varchar(20) | YES  |     | NULL    |       |
+----------+-------------+------+-----+---------+-------+
3 rows in set (0.00 sec)

mysql> table dept;
+-----+-------+----------+
| dno | name  | location |
+-----+-------+----------+
|   1 | IT    | Pune     |
|   2 | Admin | Mumbai   |
+-----+-------+----------+
2 rows in set (0.03 sec)

mysql> alter table dept
    -> modify column dno int auto_increment;
ERROR 1833 (HY000): Cannot change column 'dno': used in a foreign key constraint 'emp_ibfk_1' of table 'july25.emp'
mysql> alter table emp
    -> drop constraint emp_ibfk_1;
Query OK, 0 rows affected (0.03 sec)
Records: 0  Duplicates: 0  Warnings: 0

mysql> alter table dept
    -> modify column dno int auto_increment;
Query OK, 2 rows affected (0.07 sec)
Records: 2  Duplicates: 0  Warnings: 0

mysql> alter table dept
    -> add foreign key(dno)
    -> ^C
mysql> alter table emp
    -> add foreign key(dno)
    -> references dept(dno)
    -> on delete set null;
Query OK, 2 rows affected (0.17 sec)
Records: 2  Duplicates: 0  Warnings: 0

mysql> table emp;
+-----+--------+--------+-----------+----------+------+------+--------+------------+
| eid | name   | salary | mobno     | address  | dno  | age  | gender | j_date     |
+-----+--------+--------+-----------+----------+------+------+--------+------------+
| 101 | Deepak |  26000 | 985012468 | Parbhani |    1 |   23 | M      | 2023-02-23 |
| 102 | Sakshi |   NULL | 985012456 | Pune     | NULL | NULL | F      | NULL       |
+-----+--------+--------+-----------+----------+------+------+--------+------------+
2 rows in set (0.00 sec)

mysql> desc emp;
+---------+-------------+------+-----+---------+----------------+
| Field   | Type        | Null | Key | Default | Extra          |
+---------+-------------+------+-----+---------+----------------+
| eid     | int         | NO   | PRI | NULL    | auto_increment |
| name    | varchar(20) | NO   |     | NULL    |                |
| salary  | int         | YES  |     | NULL    |                |
| mobno   | int         | YES  | UNI | NULL    |                |
| address | varchar(20) | YES  |     | Pune    |                |
| dno     | int         | YES  | MUL | NULL    |                |
| age     | int         | YES  |     | NULL    |                |
| gender  | varchar(1)  | YES  |     | NULL    |                |
| j_date  | date        | YES  |     | NULL    |                |
+---------+-------------+------+-----+---------+----------------+
9 rows in set (0.00 sec)

mysql> alter table emp
    -> add foreign key(dno)
    -> references dept(dno)
    -> on update set null;
Query OK, 2 rows affected (0.13 sec)
Records: 2  Duplicates: 0  Warnings: 0

mysql> update emp set dno=2 where name='sakshi';
Query OK, 1 row affected (0.01 sec)
Rows matched: 1  Changed: 1  Warnings: 0

mysql> table emp;
+-----+--------+--------+-----------+----------+------+------+--------+------------+
| eid | name   | salary | mobno     | address  | dno  | age  | gender | j_date     |
+-----+--------+--------+-----------+----------+------+------+--------+------------+
| 101 | Deepak |  26000 | 985012468 | Parbhani |    1 |   23 | M      | 2023-02-23 |
| 102 | Sakshi |   NULL | 985012456 | Pune     |    2 | NULL | F      | NULL       |
+-----+--------+--------+-----------+----------+------+------+--------+------------+
2 rows in set (0.00 sec)

mysql> delete from dept where dno=2;
Query OK, 1 row affected (0.01 sec)

mysql> table emp;
+-----+--------+--------+-----------+----------+------+------+--------+------------+
| eid | name   | salary | mobno     | address  | dno  | age  | gender | j_date     |
+-----+--------+--------+-----------+----------+------+------+--------+------------+
| 101 | Deepak |  26000 | 985012468 | Parbhani |    1 |   23 | M      | 2023-02-23 |
| 102 | Sakshi |   NULL | 985012456 | Pune     | NULL | NULL | F      | NULL       |
+-----+--------+--------+-----------+----------+------+------+--------+------------+
2 rows in set (0.00 sec)

mysql> update emp set dno=2,age=25,j_date='2023-10-24' where name='sakshi';
ERROR 1452 (23000): Cannot add or update a child row: a foreign key constraint fails (`july25`.`emp`, CONSTRAINT `emp_ibfk_1` FOREIGN KEY (`dno`) REFERENCES `dept` (`dno`) ON DELETE SET NULL)
mysql> update emp set age=25,j_date='2023-10-24' where name='sakshi';
Query OK, 1 row affected (0.01 sec)
Rows matched: 1  Changed: 1  Warnings: 0

mysql> table emp;
+-----+--------+--------+-----------+----------+------+------+--------+------------+
| eid | name   | salary | mobno     | address  | dno  | age  | gender | j_date     |
+-----+--------+--------+-----------+----------+------+------+--------+------------+
| 101 | Deepak |  26000 | 985012468 | Parbhani |    1 |   23 | M      | 2023-02-23 |
| 102 | Sakshi |   NULL | 985012456 | Pune     | NULL |   25 | F      | 2023-10-24 |
+-----+--------+--------+-----------+----------+------+------+--------+------------+
2 rows in set (0.00 sec)

mysql> table dept;
+-----+------+----------+
| dno | name | location |
+-----+------+----------+
|   1 | IT   | Pune     |
+-----+------+----------+
1 row in set (0.00 sec)

mysql> insert into dept(name,location)
    -> values('Admin','Mumbai'),
    -> values('HR','Mumbai'),
    -> values('Sales','Pune');
ERROR 1064 (42000): You have an error in your SQL syntax; check the manual that corresponds to your MySQL server version for the right syntax to use near 'values('HR','Mumbai'),
values('Sales','Pune')' at line 3
mysql> insert into dept(name,location)
    -> values('Admin','Mumbai');
Query OK, 1 row affected (0.01 sec)

mysql> insert into dept(name,location)
    -> values('HR','Mumbai');
Query OK, 1 row affected (0.01 sec)

mysql> insert into dept(name,location)
    -> values('Sales','Pune');
Query OK, 1 row affected (0.01 sec)

mysql> table emp;
+-----+--------+--------+-----------+----------+------+------+--------+------------+
| eid | name   | salary | mobno     | address  | dno  | age  | gender | j_date     |
+-----+--------+--------+-----------+----------+------+------+--------+------------+
| 101 | Deepak |  26000 | 985012468 | Parbhani |    1 |   23 | M      | 2023-02-23 |
| 102 | Sakshi |   NULL | 985012456 | Pune     | NULL |   25 | F      | 2023-10-24 |
+-----+--------+--------+-----------+----------+------+------+--------+------------+
2 rows in set (0.00 sec)

mysql> table dept;
+-----+-------+----------+
| dno | name  | location |
+-----+-------+----------+
|   1 | IT    | Pune     |
|   3 | Admin | Mumbai   |
|   4 | HR    | Mumbai   |
|   5 | Sales | Pune     |
+-----+-------+----------+
4 rows in set (0.00 sec)

mysql> table emp;
+-----+--------+--------+-----------+----------+------+------+--------+------------+
| eid | name   | salary | mobno     | address  | dno  | age  | gender | j_date     |
+-----+--------+--------+-----------+----------+------+------+--------+------------+
| 101 | Deepak |  26000 | 985012468 | Parbhani |    1 |   23 | M      | 2023-02-23 |
| 102 | Sakshi |   NULL | 985012456 | Pune     | NULL |   25 | F      | 2023-10-24 |
+-----+--------+--------+-----------+----------+------+------+--------+------------+
2 rows in set (0.00 sec)

mysql> update emp set dno=5 where eid=102;
Query OK, 1 row affected (0.01 sec)
Rows matched: 1  Changed: 1  Warnings: 0

mysql> table emp;
+-----+--------+--------+-----------+----------+------+------+--------+------------+
| eid | name   | salary | mobno     | address  | dno  | age  | gender | j_date     |
+-----+--------+--------+-----------+----------+------+------+--------+------------+
| 101 | Deepak |  26000 | 985012468 | Parbhani |    1 |   23 | M      | 2023-02-23 |
| 102 | Sakshi |   NULL | 985012456 | Pune     |    5 |   25 | F      | 2023-10-24 |
+-----+--------+--------+-----------+----------+------+------+--------+------------+
2 rows in set (0.00 sec)

mysql> update dept set name='SCM' where dno=5;
Query OK, 1 row affected (0.01 sec)
Rows matched: 1  Changed: 1  Warnings: 0

mysql> table emp;
+-----+--------+--------+-----------+----------+------+------+--------+------------+
| eid | name   | salary | mobno     | address  | dno  | age  | gender | j_date     |
+-----+--------+--------+-----------+----------+------+------+--------+------------+
| 101 | Deepak |  26000 | 985012468 | Parbhani |    1 |   23 | M      | 2023-02-23 |
| 102 | Sakshi |   NULL | 985012456 | Pune     |    5 |   25 | F      | 2023-10-24 |
+-----+--------+--------+-----------+----------+------+------+--------+------------+
2 rows in set (0.00 sec)

mysql> update dept set dno=2  where name='SCM';
ERROR 1451 (23000): Cannot delete or update a parent row: a foreign key constraint fails (`july25`.`emp`, CONSTRAINT `emp_ibfk_1` FOREIGN KEY (`dno`) REFERENCES `dept` (`dno`) ON DELETE SET NULL)
mysql> table dept;
+-----+-------+----------+
| dno | name  | location |
+-----+-------+----------+
|   1 | IT    | Pune     |
|   3 | Admin | Mumbai   |
|   4 | HR    | Mumbai   |
|   5 | SCM   | Pune     |
+-----+-------+----------+
4 rows in set (0.00 sec)

mysql> delete from dept where dno=5
    -> ;
Query OK, 1 row affected (0.01 sec)

mysql> table dept;
+-----+-------+----------+
| dno | name  | location |
+-----+-------+----------+
|   1 | IT    | Pune     |
|   3 | Admin | Mumbai   |
|   4 | HR    | Mumbai   |
+-----+-------+----------+
3 rows in set (0.00 sec)

mysql> table emp;;
+-----+--------+--------+-----------+----------+------+------+--------+------------+
| eid | name   | salary | mobno     | address  | dno  | age  | gender | j_date     |
+-----+--------+--------+-----------+----------+------+------+--------+------------+
| 101 | Deepak |  26000 | 985012468 | Parbhani |    1 |   23 | M      | 2023-02-23 |
| 102 | Sakshi |   NULL | 985012456 | Pune     | NULL |   25 | F      | 2023-10-24 |
+-----+--------+--------+-----------+----------+------+------+--------+------------+
2 rows in set (0.00 sec)

ERROR:
No query specified

mysql> table emp;
+-----+--------+--------+-----------+----------+------+------+--------+------------+
| eid | name   | salary | mobno     | address  | dno  | age  | gender | j_date     |
+-----+--------+--------+-----------+----------+------+------+--------+------------+
| 101 | Deepak |  26000 | 985012468 | Parbhani |    1 |   23 | M      | 2023-02-23 |
| 102 | Sakshi |   NULL | 985012456 | Pune     | NULL |   25 | F      | 2023-10-24 |
+-----+--------+--------+-----------+----------+------+------+--------+------------+
2 rows in set (0.00 sec)

mysql> create table shirt
    -> (srno int,
    -> type varchar(20),
    -> size enum('s','m','l','xl','xxl'));
Query OK, 0 rows affected (0.03 sec)